{
  "schema_version": 1,
  "campaign_id": "candidate-qualification-v1-20260716-9ccc03a2c582",
  "campaign_sha256": "sha256:28c8bd9cc71c8c6f260a2504fac05731ae98966a62ab3b8e5f1331599d31427a",
  "attempt_id": "quick-ignore-config-v1-clean-q2",
  "case_id": "quick/ignore-config/v1",
  "repetition_id": "clean-q2",
  "outcome": "passed",
  "admitted_at": "2026-07-16T19:19:11.136Z",
  "terminal_at": "2026-07-16T19:21:12.700Z",
  "evidence": [
    "run:20260716-191929-run-role-builder",
    "run:20260716-192013-run-role-builder",
    "grader:grader/quick-ignore-config-v1-clean-q2.json",
    "run:20260716-192101-run-role-reviewer",
    "accounting:accounting/quick-ignore-config-v1-clean-q2.json"
  ],
  "metrics": {
    "route": {
      "planned": "quick",
      "final": "quick",
      "model_turns": 3
    },
    "context": {
      "rendered_bytes": 3514,
      "sources": {
        "run:20260716-191929-run-role-builder": 437,
        "run:20260716-192013-run-role-builder": 1142,
        "run:20260716-192101-run-role-reviewer": 1935
      },
      "measurement": "durable_context_manifests"
    },
    "cost": {
      "equivalent_usd": 1.623258,
      "product_usd": 1.299585,
      "evaluator_usd": 0.32367300000000004,
      "quality": "estimated"
    },
    "tokens": {
      "input": 308231,
      "output": 5802,
      "quality": "estimated"
    },
    "latency": {
      "elapsed_ms": 121564,
      "active_ms": 121564,
      "human_wait_ms": 0
    },
    "human_load": {
      "decisions": 0
    },
    "productivity": {
      "productive_passes": 3,
      "total_passes": 3,
      "ratio": 1,
      "repeated_work_cost_usd": 0,
      "evidence": [
        {
          "kind": "contract",
          "before_sha256": "sha256:01ba4719c80b6fe911b091a7c05124b64eeece964e09c058ef8f9805daca546b",
          "after_sha256": "sha256:cfda8489823729193d5cc5e795407f3bec73a4c5a477558ac603cecb9b18b3e3",
          "productive": true
        },
        {
          "kind": "implementation",
          "before_sha256": "sha256:cfda8489823729193d5cc5e795407f3bec73a4c5a477558ac603cecb9b18b3e3",
          "after_sha256": "sha256:e6479d1f8d8045bffee5732133cb94f1c454e757ede51bf7d6caf6ff922c66ef",
          "productive": true
        },
        {
          "kind": "review",
          "before_sha256": "sha256:e6479d1f8d8045bffee5732133cb94f1c454e757ede51bf7d6caf6ff922c66ef",
          "after_sha256": "sha256:e6479d1f8d8045bffee5732133cb94f1c454e757ede51bf7d6caf6ff922c66ef",
          "productive": true
        }
      ]
    },
    "continuation": {
      "excluded": [
        "not_continuation_case"
      ]
    },
    "approvals": {
      "excluded": [
        "not_approval_case"
      ]
    },
    "scheduler": {
      "excluded": [
        "not_scheduler_case"
      ]
    },
    "learning": {
      "excluded": [
        "not_learning_case"
      ]
    },
    "execution": {
      "terminal_integrity": 1,
      "provider_turns": 3,
      "mechanical_steps": 0,
      "provider_settlements": 3,
      "mechanical_settlements": 0
    },
    "capabilities": {
      "outward_effects": 0,
      "hidden_answer_leakage": false,
      "production_path_overlap": false
    }
  },
  "exclusions": [],
  "missing": []
}
