{
  "schema_version": 1,
  "campaign_id": "candidate-qualification-v1-20260716-9ccc03a2c582",
  "campaign_sha256": "sha256:28c8bd9cc71c8c6f260a2504fac05731ae98966a62ab3b8e5f1331599d31427a",
  "attempt_id": "quick-ignore-config-v1-mixed-q1",
  "case_id": "quick/ignore-config/v1",
  "repetition_id": "mixed-q1",
  "outcome": "passed",
  "admitted_at": "2026-07-16T19:30:05.203Z",
  "terminal_at": "2026-07-16T19:31:43.097Z",
  "evidence": [
    "run:20260716-193035-run-role-builder",
    "run:20260716-193118-run-role-builder",
    "grader:grader/quick-ignore-config-v1-mixed-q1.json",
    "run:20260716-193151-run-role-reviewer",
    "accounting:accounting/quick-ignore-config-v1-mixed-q1.json"
  ],
  "metrics": {
    "route": {
      "planned": "quick",
      "final": "quick",
      "model_turns": 3
    },
    "context": {
      "rendered_bytes": 3514,
      "sources": {
        "run:20260716-193035-run-role-builder": 437,
        "run:20260716-193118-run-role-builder": 1142,
        "run:20260716-193151-run-role-reviewer": 1935
      },
      "measurement": "durable_context_manifests"
    },
    "cost": {
      "equivalent_usd": 1.3253775,
      "product_usd": 1.005065,
      "evaluator_usd": 0.3203125,
      "quality": "estimated"
    },
    "tokens": {
      "input": 253795,
      "output": 4787,
      "quality": "estimated"
    },
    "latency": {
      "elapsed_ms": 97894,
      "active_ms": 97894,
      "human_wait_ms": 0
    },
    "human_load": {
      "decisions": 0
    },
    "productivity": {
      "productive_passes": 3,
      "total_passes": 3,
      "ratio": 1,
      "repeated_work_cost_usd": 0,
      "evidence": [
        {
          "kind": "contract",
          "before_sha256": "sha256:01ba4719c80b6fe911b091a7c05124b64eeece964e09c058ef8f9805daca546b",
          "after_sha256": "sha256:1a7aaff8c879676254c4c7b7826b14a81be29963fa0d794d0b6e87230bfe5fce",
          "productive": true
        },
        {
          "kind": "implementation",
          "before_sha256": "sha256:1a7aaff8c879676254c4c7b7826b14a81be29963fa0d794d0b6e87230bfe5fce",
          "after_sha256": "sha256:78514f1bd92ce67e72ebd943cb17a830d70f454d963ffd3e575d0e84d2cf64d9",
          "productive": true
        },
        {
          "kind": "review",
          "before_sha256": "sha256:78514f1bd92ce67e72ebd943cb17a830d70f454d963ffd3e575d0e84d2cf64d9",
          "after_sha256": "sha256:78514f1bd92ce67e72ebd943cb17a830d70f454d963ffd3e575d0e84d2cf64d9",
          "productive": true
        }
      ]
    },
    "continuation": {
      "excluded": [
        "not_continuation_case"
      ]
    },
    "approvals": {
      "excluded": [
        "not_approval_case"
      ]
    },
    "scheduler": {
      "excluded": [
        "not_scheduler_case"
      ]
    },
    "learning": {
      "excluded": [
        "not_learning_case"
      ]
    },
    "execution": {
      "terminal_integrity": 1,
      "provider_turns": 3,
      "mechanical_steps": 0,
      "provider_settlements": 3,
      "mechanical_settlements": 0
    },
    "capabilities": {
      "outward_effects": 0,
      "hidden_answer_leakage": false,
      "production_path_overlap": false
    }
  },
  "exclusions": [],
  "missing": []
}
