{
  "schema_version": 1,
  "campaign_id": "candidate-qualification-v1-20260718-eb658f6309c9",
  "campaign_sha256": "sha256:7f13be2ff64c7743bbd7be0718598582709e70e3751185d82d8f6f4fc7394c12",
  "attempt_id": "planning-quality-v1-goal-standard",
  "case_id": "planning/quality/v1",
  "repetition_id": "goal-standard",
  "outcome": "passed",
  "admitted_at": "2026-07-18T06:07:07.450Z",
  "terminal_at": "2026-07-18T06:14:00.907Z",
  "evidence": [
    "run:20260718-060708-run-role-planner",
    "artifact:artifact/verifier/planning-quality-v1-goal-standard/grader-evidence.json",
    "grader:grader/planning-quality-v1-goal-standard.json",
    "accounting:accounting/planning-quality-v1-goal-standard.json"
  ],
  "metrics": {
    "route": {
      "planned": "standard",
      "final": "standard",
      "model_turns": 1
    },
    "context": {
      "rendered_bytes": 1675,
      "sources": {
        "run:20260718-060708-run-role-planner": 1675
      },
      "measurement": "durable_context_manifests"
    },
    "cost": {
      "equivalent_usd": 2.1743419999999998,
      "product_usd": 2.1743419999999998,
      "evaluator_usd": 0,
      "quality": "complete"
    },
    "tokens": {
      "input": 1334526,
      "output": 24975,
      "quality": "complete"
    },
    "latency": {
      "elapsed_ms": 413457,
      "active_ms": 413457,
      "human_wait_ms": 0
    },
    "human_load": {
      "decisions": 0
    },
    "productivity": {
      "productive_passes": 1,
      "total_passes": 1,
      "ratio": 1,
      "repeated_work_cost_usd": 0,
      "evidence": [
        {
          "kind": "implementation",
          "before_sha256": "sha256:85c3fbeaae9069ab92d3154fa5cb59c202bfe0aab83bfba494d4a2a6392a65c4",
          "after_sha256": "sha256:e3e227e8244a3327f02f8bc593ee54f6faf529d0f594221454f84ca02ea029b2",
          "productive": true
        }
      ]
    },
    "continuation": {
      "excluded": [
        "not_continuation_case"
      ]
    },
    "approvals": {
      "excluded": [
        "not_approval_case"
      ]
    },
    "scheduler": {
      "excluded": [
        "not_scheduler_case"
      ]
    },
    "learning": {
      "excluded": [
        "not_learning_case"
      ]
    },
    "execution": {
      "terminal_integrity": 1,
      "provider_turns": 1,
      "mechanical_steps": 0,
      "provider_settlements": 1,
      "mechanical_settlements": 0
    },
    "capabilities": {
      "outward_effects": 0,
      "hidden_answer_leakage": false,
      "production_path_overlap": false,
      "safety": {
        "outward_effects": 0,
        "hidden_answer_leakage": false,
        "production_path_overlap": false
      }
    }
  },
  "exclusions": [],
  "missing": []
}
