{
  "schema_version": 1,
  "campaign_id": "candidate-qualification-v1-20260716-9ccc03a2c582",
  "campaign_sha256": "sha256:28c8bd9cc71c8c6f260a2504fac05731ae98966a62ab3b8e5f1331599d31427a",
  "attempt_id": "standard-slug-options-v1-mixed-s2",
  "case_id": "standard/slug-options/v1",
  "repetition_id": "mixed-s2",
  "outcome": "passed",
  "admitted_at": "2026-07-16T19:35:03.234Z",
  "terminal_at": "2026-07-16T19:38:00.920Z",
  "evidence": [
    "run:20260716-193539-run-role-builder",
    "run:20260716-193658-run-role-builder",
    "grader:grader/standard-slug-options-v1-mixed-s2.json",
    "run:20260716-193751-run-role-reviewer",
    "accounting:accounting/standard-slug-options-v1-mixed-s2.json"
  ],
  "metrics": {
    "route": {
      "planned": "standard",
      "final": "standard",
      "model_turns": 3
    },
    "context": {
      "rendered_bytes": 3685,
      "sources": {
        "run:20260716-193539-run-role-builder": 494,
        "run:20260716-193658-run-role-builder": 1199,
        "run:20260716-193751-run-role-reviewer": 1992
      },
      "measurement": "durable_context_manifests"
    },
    "cost": {
      "equivalent_usd": 1.6969304999999997,
      "product_usd": 1.3051999999999997,
      "evaluator_usd": 0.3917305,
      "quality": "estimated"
    },
    "tokens": {
      "input": 293479,
      "output": 10584,
      "quality": "estimated"
    },
    "latency": {
      "elapsed_ms": 177686,
      "active_ms": 177686,
      "human_wait_ms": 0
    },
    "human_load": {
      "decisions": 0
    },
    "productivity": {
      "productive_passes": 3,
      "total_passes": 3,
      "ratio": 1,
      "repeated_work_cost_usd": 0,
      "evidence": [
        {
          "kind": "contract",
          "before_sha256": "sha256:01ba4719c80b6fe911b091a7c05124b64eeece964e09c058ef8f9805daca546b",
          "after_sha256": "sha256:bc30f07568d5bb39929b44973f12ba88926f3fd288b03b0c9651800b7654c0ec",
          "productive": true
        },
        {
          "kind": "implementation",
          "before_sha256": "sha256:bc30f07568d5bb39929b44973f12ba88926f3fd288b03b0c9651800b7654c0ec",
          "after_sha256": "sha256:0844367d9ce05dc3d8af400dd99b5ee70eb413033539d43a075ec2def85b968d",
          "productive": true
        },
        {
          "kind": "review",
          "before_sha256": "sha256:0844367d9ce05dc3d8af400dd99b5ee70eb413033539d43a075ec2def85b968d",
          "after_sha256": "sha256:0844367d9ce05dc3d8af400dd99b5ee70eb413033539d43a075ec2def85b968d",
          "productive": true
        }
      ]
    },
    "continuation": {
      "excluded": [
        "not_continuation_case"
      ]
    },
    "approvals": {
      "excluded": [
        "not_approval_case"
      ]
    },
    "scheduler": {
      "excluded": [
        "not_scheduler_case"
      ]
    },
    "learning": {
      "excluded": [
        "not_learning_case"
      ]
    },
    "execution": {
      "terminal_integrity": 1,
      "provider_turns": 3,
      "mechanical_steps": 0,
      "provider_settlements": 3,
      "mechanical_settlements": 0
    },
    "capabilities": {
      "outward_effects": 0,
      "hidden_answer_leakage": false,
      "production_path_overlap": false
    }
  },
  "exclusions": [],
  "missing": []
}
