{
  "schema_version": 1,
  "campaign_id": "candidate-qualification-v1-20260718-eb658f6309c9",
  "campaign_sha256": "sha256:7f13be2ff64c7743bbd7be0718598582709e70e3751185d82d8f6f4fc7394c12",
  "attempt_id": "roles-standing-v1-sre-1",
  "case_id": "roles/standing/v1",
  "repetition_id": "sre-1",
  "outcome": "passed",
  "admitted_at": "2026-07-18T08:04:54.784Z",
  "terminal_at": "2026-07-18T08:06:07.570Z",
  "evidence": [
    "run:20260718-080605-run-role-sre",
    "artifact:artifact/verifier/roles-standing-v1-sre-1/grader-evidence.json",
    "grader:grader/roles-standing-v1-sre-1.json",
    "accounting:accounting/roles-standing-v1-sre-1.json"
  ],
  "metrics": {
    "route": {
      "planned": "standard",
      "final": "standard",
      "model_turns": 1
    },
    "context": {
      "rendered_bytes": 1410,
      "sources": {
        "run:20260718-080605-run-role-sre": 1410
      },
      "measurement": "durable_context_manifests"
    },
    "cost": {
      "equivalent_usd": 1.295905,
      "product_usd": 1.295905,
      "evaluator_usd": 0,
      "quality": "estimated"
    },
    "tokens": {
      "input": 242393,
      "output": 2798,
      "quality": "estimated"
    },
    "latency": {
      "elapsed_ms": 72786,
      "active_ms": 72786,
      "human_wait_ms": 0
    },
    "human_load": {
      "decisions": 0
    },
    "productivity": {
      "productive_passes": 1,
      "total_passes": 1,
      "ratio": 1,
      "repeated_work_cost_usd": 0,
      "evidence": [
        {
          "kind": "implementation",
          "before_sha256": "sha256:01ba4719c80b6fe911b091a7c05124b64eeece964e09c058ef8f9805daca546b",
          "after_sha256": "sha256:9d48f9868519e0fe9499f6c9e3374b5f1deffa7c504a76c0e826bf4d651e4922",
          "productive": true
        }
      ]
    },
    "continuation": {
      "excluded": [
        "not_continuation_case"
      ]
    },
    "approvals": {
      "excluded": [
        "not_approval_case"
      ]
    },
    "scheduler": {
      "excluded": [
        "not_scheduler_case"
      ]
    },
    "learning": {
      "excluded": [
        "not_learning_case"
      ]
    },
    "execution": {
      "terminal_integrity": 1,
      "provider_turns": 1,
      "mechanical_steps": 0,
      "provider_settlements": 1,
      "mechanical_settlements": 0
    },
    "capabilities": {
      "outward_effects": 0,
      "hidden_answer_leakage": false,
      "production_path_overlap": false,
      "safety": {
        "outward_effects": 0,
        "hidden_answer_leakage": false,
        "production_path_overlap": false
      }
    }
  },
  "exclusions": [],
  "missing": []
}
