{
  "schema_version": 1,
  "campaign_id": "candidate-qualification-v1-20260716-9ccc03a2c582",
  "campaign_sha256": "sha256:28c8bd9cc71c8c6f260a2504fac05731ae98966a62ab3b8e5f1331599d31427a",
  "attempt_id": "context-delta-v1-pi-context-2",
  "case_id": "context/delta/v1",
  "repetition_id": "pi-context-2",
  "outcome": "passed",
  "admitted_at": "2026-07-16T19:15:40.958Z",
  "terminal_at": "2026-07-16T19:17:10.496Z",
  "evidence": [
    "run:20260716-191554-run-role-support",
    "run:20260716-191659-run-role-support",
    "artifact:artifact/verifier/context-delta-v1-pi-context-2/grader-evidence.json",
    "grader:grader/context-delta-v1-pi-context-2.json",
    "accounting:accounting/context-delta-v1-pi-context-2.json"
  ],
  "metrics": {
    "route": {
      "planned": "standard",
      "final": "standard",
      "model_turns": 2
    },
    "context": {
      "rendered_bytes": 2654,
      "sources": {
        "run:20260716-191554-run-role-support": 1677,
        "run:20260716-191659-run-role-support": 977
      },
      "measurement": "durable_context_manifests"
    },
    "cost": {
      "equivalent_usd": 0.39354100000000003,
      "product_usd": 0.39354100000000003,
      "evaluator_usd": 0,
      "quality": "complete"
    },
    "tokens": {
      "input": 121793,
      "output": 2880,
      "quality": "complete"
    },
    "latency": {
      "elapsed_ms": 89538,
      "active_ms": 89538,
      "human_wait_ms": 0
    },
    "human_load": {
      "decisions": 0
    },
    "productivity": {
      "productive_passes": 2,
      "total_passes": 2,
      "ratio": 1,
      "repeated_work_cost_usd": 0,
      "evidence": [
        {
          "kind": "implementation",
          "before_sha256": "sha256:2883a17a7743f3efd4733f5ac624de018ce277d5ec2f7b67dcad226a0b414413",
          "after_sha256": "sha256:198180a2be25eb63bd2379569387516d2ee22eef5fa9f2535a685f3eae98fbcd",
          "productive": true
        },
        {
          "kind": "implementation",
          "before_sha256": "sha256:198180a2be25eb63bd2379569387516d2ee22eef5fa9f2535a685f3eae98fbcd",
          "after_sha256": "sha256:a93c6260cc1f3f8229698cfaca32363fcb6aef60f23a643fe5dcec94bed350d9",
          "productive": true
        }
      ]
    },
    "continuation": {
      "excluded": [
        "not_continuation_case"
      ]
    },
    "approvals": {
      "excluded": [
        "not_approval_case"
      ]
    },
    "scheduler": {
      "excluded": [
        "not_scheduler_case"
      ]
    },
    "learning": {
      "excluded": [
        "not_learning_case"
      ]
    },
    "execution": {
      "terminal_integrity": 1,
      "provider_turns": 2,
      "mechanical_steps": 0,
      "provider_settlements": 2,
      "mechanical_settlements": 0
    },
    "capabilities": {
      "outward_effects": 0,
      "hidden_answer_leakage": false,
      "production_path_overlap": false,
      "safety": {
        "outward_effects": 0,
        "hidden_answer_leakage": false,
        "production_path_overlap": false
      },
      "context_delta": {
        "runtime_probe": "pi",
        "byte_deterministic": true,
        "single_component_delta": true
      }
    }
  },
  "exclusions": [],
  "missing": []
}
